{
  "schemaVersion": "1.1.0",
  "locale": "de-DE",
  "safetyAdvice": "Belastung schrittweise steigern und Bewegungen nur kontrolliert und beschwerdearm ausführen. Bei wiederholtem Wegknicken, Gelenkschwellung, deutlichen Schmerzen oder schmerzhafter Knieüberstreckung fachlich abklären. Bei Gelenkhypermobilität keine aggressiven Endbereichs-Dehnungen erzwingen. PNF-Diagonalen sind Koordinationsübungen und nicht automatisch eine Korrektur des Gangbilds. Die Übungen sind allgemeine Trainingsvorschläge, keine Diagnose oder individuelle Therapie.",
  "exercises": [
    {
      "id": "kniebeuge_miniband",
      "title": "Kniebeuge mit Miniband",
      "subtitle": "Gesäß & Kniekontrolle",
      "description": "Dynamische Kniebeuge mit leichtem Bandwiderstand als Feedback für Hüfte und Beinachse.",
      "movementType": "dynamic",
      "difficulty": "beginner",
      "focusAreas": [
        "quadriceps",
        "gluteus_maximus",
        "hip_abductors"
      ],
      "runnerGoals": [
        "running_strength",
        "knee_tracking",
        "hip_stability"
      ],
      "equipment": [
        "mini_band"
      ],
      "prescription": {
        "type": "repetitions",
        "reps": 10,
        "perSide": false,
        "restSeconds": 40,
        "tempo": "3-0-1-0"
      },
      "steps": [
        "Lege ein leichtes Miniband knapp oberhalb der Knie an und stelle die Füße etwa hüft- bis schulterbreit auf.",
        "Verteile das Gewicht auf Ferse, Großzehen- und Kleinzehenballen.",
        "Beuge Hüfte und Knie in etwa 3 Sekunden und führe das Gesäß nach hinten.",
        "Richte dich kontrolliert wieder auf; die Knie folgen dabei ungefähr der Richtung der Füße."
      ],
      "techniqueCues": [
        "Halte eine leichte Bandspannung, ohne die Knie maximal nach außen zu drücken.",
        "Bewege dich nur so tief, wie du Fußkontakt und Beinachse kontrollierst."
      ],
      "tip": "Das Band ist ein Technik-Feedback; es korrigiert keine strukturellen X-Beine.",
      "commonMistakes": [
        "Knie stark gegen das Band nach außen pressen.",
        "Fersen anheben oder ins Hohlkreuz ausweichen."
      ],
      "cautions": [
        "Bei Knieschmerzen Tiefe und Bandspannung reduzieren."
      ],
      "regression": "Kniebeuge zu einem hohen Stuhl, zunächst ohne Band.",
      "progression": "Tiefer oder mit moderatem Zusatzgewicht arbeiten, sobald die Bewegung stabil bleibt.",
      "media": {
        "imageKey": "kniebeuge_miniband",
        "altText": "Schildkröte macht eine Kniebeuge mit Miniband oberhalb der Knie.",
        "illustrationDirection": "Rosa Schildkröte mit dunkelgrünem Panzer und pinkem Stirnband, klare Seitenansicht, cremefarbener Hintergrund. Beide Füße auf dem Boden, Miniband deutlich oberhalb der Knie, Hüfte zurück, Knie kontrolliert über den Füßen."
      }
    },
    {
      "id": "wandsitz_90_90",
      "title": "90/90-Wandsitz",
      "subtitle": "Oberschenkel & Haltekraft",
      "description": "Freier Wandsitz ohne Stuhl für isometrische Kraft und kontrollierte Knieposition.",
      "movementType": "isometric",
      "difficulty": "intermediate",
      "focusAreas": [
        "quadriceps",
        "gluteus_maximus"
      ],
      "runnerGoals": [
        "running_strength",
        "downhill",
        "knee_tracking"
      ],
      "equipment": [
        "wall"
      ],
      "prescription": {
        "type": "hold",
        "holdSeconds": 30,
        "perSide": false,
        "restSeconds": 45
      },
      "steps": [
        "Lehne den Rücken an eine rutschfeste Wand und stelle die Füße ein Stück davor auf.",
        "Rutsche langsam nach unten, bis Knie und Hüften ungefähr 90 Grad gebeugt sind, sofern beschwerdefrei möglich.",
        "Halte die Füße voll am Boden und die Knie ungefähr in Fußrichtung.",
        "Atme ruhig weiter und schiebe dich nach der Haltezeit kontrolliert wieder hoch."
      ],
      "techniqueCues": [
        "Der Rücken bleibt an der Wand; kein Stuhl trägt das Körpergewicht.",
        "Halte die Knie ruhig, ohne sie nach innen oder außen zu erzwingen."
      ],
      "tip": "90 Grad sind keine Pflicht: Ein höherer Wandsitz ist bei Bedarf sinnvoll.",
      "commonMistakes": [
        "Luft anhalten.",
        "Zu tiefe Position trotz Knieschmerzen erzwingen."
      ],
      "cautions": [
        "Bei Schmerzen im Knie, insbesondere vorn, Beugewinkel reduzieren oder Übung auslassen."
      ],
      "regression": "Wandsitz mit etwa 45–60 Grad Kniebeugung und kürzerer Haltezeit.",
      "progression": "Auf 40–45 Sekunden steigern, bevor Zusatzgewicht ergänzt wird.",
      "media": {
        "imageKey": "wandsitz_90_90",
        "altText": "Schildkröte hält einen freien Wandsitz mit ungefähr 90 Grad Kniebeugung.",
        "illustrationDirection": "Rosa Schildkröte mit dunkelgrünem Panzer und pinkem Stirnband, klare Seitenansicht, cremefarbener Hintergrund. Rücken an gerader Wand, ohne Stuhl, Oberschenkel beinahe horizontal, beide Füße flach aufgestellt."
      }
    },
    {
      "id": "step_up_bergauf",
      "title": "Step-up auf die Stufe",
      "subtitle": "Gesäß & Kraft bergauf",
      "description": "Einbeinige Aufwärtsbewegung für Hüft- und Kniestrecker mit Übertrag auf Steigungen.",
      "movementType": "dynamic",
      "difficulty": "beginner",
      "focusAreas": [
        "quadriceps",
        "gluteus_maximus",
        "hip_abductors"
      ],
      "runnerGoals": [
        "running_strength",
        "uphill",
        "knee_tracking"
      ],
      "equipment": [
        "step",
        "optional_support"
      ],
      "prescription": {
        "type": "repetitions",
        "reps": 8,
        "perSide": true,
        "restSeconds": 40,
        "tempo": "2-0-2-0"
      },
      "steps": [
        "Stelle einen Fuß vollständig auf eine feste, niedrige Stufe (etwa 10–20 cm zum Einstieg).",
        "Verlagere das Gewicht auf das obere Bein und richte dich über dessen Hüfte und Knie auf.",
        "Stehe oben stabil, ohne das Standknie nach hinten durchzudrücken.",
        "Senke dich langsam mit Kontrolle ab und wiederhole auf derselben Seite."
      ],
      "techniqueCues": [
        "Schiebe dich hauptsächlich mit dem oberen Bein hoch.",
        "Halte Becken und Knie des Standbeins möglichst ruhig."
      ],
      "tip": "Eine niedrigere Stufe mit guter Kontrolle ist sinnvoller als eine hohe Stufe mit Ausweichbewegung.",
      "commonMistakes": [
        "Mit dem unteren Bein kräftig abspringen.",
        "Mit dem Standknie nach innen fallen."
      ],
      "cautions": [
        "Nur eine sichere, kippsichere Stufe verwenden; bei Schwindel festhalten."
      ],
      "regression": "Niedrigere Stufe und leichte Handunterstützung.",
      "progression": "Stufenhöhe oder äußere Last schrittweise erhöhen, ohne die Beinachse zu verlieren.",
      "media": {
        "imageKey": "step_up_bergauf",
        "altText": "Schildkröte steigt mit einem Bein auf eine niedrige Trainingsstufe.",
        "illustrationDirection": "Rosa Schildkröte mit dunkelgrünem Panzer und pinkem Stirnband, klare Seitenansicht, cremefarbener Hintergrund. Ein Fuß steht vollständig auf einer niedrigen stabilen Stufe; Hüfte streckt sich beim Aufsteigen."
      }
    },
    {
      "id": "step_down_bergab",
      "title": "Langsamer Step-down",
      "subtitle": "Oberschenkel & Kraft bergab",
      "description": "Betont die kontrollierte, exzentrische Belastung des Standbeins wie beim Abbremsen bergab.",
      "movementType": "dynamic",
      "difficulty": "intermediate",
      "focusAreas": [
        "quadriceps",
        "gluteus_maximus",
        "hip_abductors"
      ],
      "runnerGoals": [
        "running_strength",
        "downhill",
        "knee_tracking"
      ],
      "equipment": [
        "step",
        "optional_support"
      ],
      "prescription": {
        "type": "repetitions",
        "reps": 6,
        "perSide": true,
        "restSeconds": 50,
        "tempo": "4-0-2-0"
      },
      "steps": [
        "Stehe auf einer stabilen, niedrigen Stufe mit einem Fuß, das andere Bein hängt frei nach vorn.",
        "Beuge das Standknie und senke die freie Ferse in etwa 4 Sekunden Richtung Boden.",
        "Berühre den Boden nur leicht, ohne das ganze Gewicht auf das freie Bein zu verlagern.",
        "Richte dich kontrolliert über das Standbein auf; vermeide ein Einrasten in Überstreckung."
      ],
      "techniqueCues": [
        "Lass das Standknie ungefähr den Zehen folgen.",
        "Halte das Becken möglichst waagerecht und die Bewegung langsam."
      ],
      "tip": "Die langsame Absenkphase ist wichtiger als die Stufenhöhe.",
      "commonMistakes": [
        "Freies Bein abstellen und damit hochdrücken.",
        "Standknie schnell nach innen kippen lassen."
      ],
      "cautions": [
        "Exzentrische Belastung langsam steigern; bei gereizter Kniescheibe kleinere Stufe wählen."
      ],
      "regression": "5–10-cm-Stufe oder Handstütze und geringere Senktiefe.",
      "progression": "Größere Stufe oder leichte Zusatzlast erst bei gleichbleibender Kontrolle.",
      "media": {
        "imageKey": "step_down_bergab",
        "altText": "Schildkröte senkt auf einer Stufe das freie Bein langsam Richtung Boden.",
        "illustrationDirection": "Rosa Schildkröte mit dunkelgrünem Panzer und pinkem Stirnband, klare Seitenansicht, cremefarbener Hintergrund. Ein Bein auf niedriger Stufe, das andere wird zur Bodenkontaktprobe kontrolliert abgesenkt."
      }
    },
    {
      "id": "einbeinstand_weiches_knie",
      "title": "Einbeinstand mit weichem Knie",
      "subtitle": "Kniekontrolle & Gleichgewicht",
      "description": "Kontrolle der Kniestreckung im Einbeinstand, ohne passiv in die Überstreckung zu fallen.",
      "movementType": "motor_control",
      "difficulty": "beginner",
      "focusAreas": [
        "knee_proprioception",
        "hamstrings",
        "ankle_stabilizers"
      ],
      "runnerGoals": [